Golf Course Name,Address,City,State,Golf Course Website,,,,,,,,,,
San Pedro Golf Course,"926 North Madison Ave, Benson, AZ 85602",Benson,AZ,http://www.sanpedrogolf.com,,,,,,,,,,
Genegantslet Golf Club,"686 State Highway 12, Greene, NY 13778-2286",Greene,NY,https://www.gennygolf.com/,,,,,,,,,,
Bobby Jones Golf Course,"384 Woodward Way NW, Atlanta, GA 30305-4081",Atlanta,GA,http://www.bobbyjonesgc.com/,,,,,,,,,,
Moody Gardens,"1700 Sydnor Ln, Galveston, TX 77554-6306",Galveston,TX,http://www.moodygardensgolf.com,,,,,,,,,,
Colony West Country Club | Championship,"6800 NW 88th Ave, Tamarac, FL 33321-3799",Tamarac,FL,http://www.golfcolonywest.com,,,,,,,,,,
The Club At Savannah Harbor,"2 Resort Dr, Savannah, GA 31421-7001",Savannah,GA,http://www.theclubatsavannahharbor.com,,,,,,,,,,
Jefferson District Golf Course,"7900 Lee Highway, Falls Church, VA 22042",Falls Church,VA,http://www.fairfaxcounty.gov/parks/golf/jeffersongc/,,,,,,,,,,
NorthBrook Country Club,"407 Northbrook Rd, Luxemburg, WI 54217-8397",Luxemburg,WI,http://www.northbrookcc.com,,,,,,,,,,
Miacomet Golf Course,"12 W. Miacomet Rd., Nantucket Island, MA 02554",Nantucket Island,MA,http://www.miacometgolf.com,,,,,,,,,,
Prairie View,"7993 N River Rd, Byron, IL 61010-9533",Byron,IL,http://www.prairieviewgolf.com,,,,,,,,,,
Hells Point Golf Course,"2700 Atwoodtown Rd, Virginia Beach, VA 23456",Virginia Beach,VA,http://www.hellspoint.com,,,,,,,,,,
Heritage Creek Golf Club,"1949 Meetinghouse Rd., Jamison, PA 18929",Jamison,PA,http://www.heritagecreekgolfclub.com/,,,,,,,,,,
Sleepy Hole Golf Course,"4700 Sleepy Hole Road, Suffolk, VA 23435",Suffolk,VA,http://www.sleepyholegolfcourse.com/,,,,,,,,,,
Greenfield Lakes Golf Course,"2484 E Warner Rd, Gilbert, AZ 85296",Gilbert,AZ,http://www.greenfieldlakesgolfcourse.com,,,,,,,,,,
Chariot Run Golf Club,"8191 Chariot Run Dr SE, Laconia, IN 47135-9464",Laconia,IN,http://www.chariotrun.com,,,,,,,,,,
A.J. Jolly Golf Course,"11541 Alexandria Pike, Alexandria, KY 41001-7779",Alexandria,KY,http://www.ajjolly.com,,,,,,,,,,
Rio Secco Golf Club,"2851 Grand Hills Dr., Henderson, NV 89052",Henderson,NV,http://www.riosecco.net/,,,,,,,,,,
Carolina Lakes Golf Club,"23012 Kingfisher Dr, Fort Mill, SC 29707",Fort Mill,SC,http://www.carolinalakesgc.com/,,,,,,,,,,
Perdido Bay Golf Club,"1 Doug Ford Dr, Perdido Bay, FL 32507",Perdido Bay,FL,http://www.perdidobaygolf.com,,,,,,,,,,
Mosholu Golf Course,"3751 Jerome Ave, Bronx, NY 10467",Bronx,NY,http://www.mosholugolfcourse.com,,,,,,,,,,
Stonelick Hills Golf Course,"3155 Sherilyn Ln, Batavia, OH 45103",Batavia,OH,http://www.stonelickhills.com,,,,,,,,,,
The Golf Club at the Resort,"5700 Resort Blvd., Fort Worth, TX 76179",Fort Worth,TX,http://www.resortgolfclub.com,,,,,,,,,,
Eagle Crest Golf Course,"2203 Thomas W Ryan Blvd, Las Vegas, NV 89134",Las Vegas,NV,http://www.golfsummerlin.com,,,,,,,,,,
Biltmore Golf Course,"1210 Anastasia Ave, Coconut Grove, FL 33134",Coconut Grove,FL,http://www.biltmorehotel.com/golf.php,,,,,,,,,,
Diamondback Golf Club,"1510 E. Industrial, Abilene, TX 79602",Abilene,TX,http://www.diamondbackgolfclub.biz/,,,,,,,,,,
Ahwatukee Country Club,"12432 S 48th St, Phoenix, AZ 85044-3351",Phoenix,AZ,http://www.ahwatukeegc.com,,,,,,,,,,
Indian Wells Golf Resort - Players,"44-500 Indian Wells Lane, Indian Wells, CA 92210",Indian Wells,CA,http://www.indianwellsgolfresort.com,,,,,,,,,,
San Dimas Canyon Golf Course,"2100 Terrebonne Ave, San Dimas, CA 91773-1349",San Dimas,CA,https://www.sandimasgc.com/,,,,,,,,,,
Fairview Golf Course,"2399 Quentin Rd, Lebanon, PA 17042-9040",Lebanon,PA,http://www.fairview.distinctgolf.com,,,,,,,,,,
Ironwood Golf Course,"2100 NE 39th Ave, Gainesville, FL 32609-2033",Gainesville,FL,http://www.ironwoodgolfcourse.org/,,,,,,,,,,
Casselberry Golf Club,"300 South Lake Triplett Drive, Casselberry, FL 32707",Casselberry,FL,http://www.casselberrygc.com,,,,,,,,,,
Little Bennett Golf Course,"25900 Prescott Rd, Clarksburg, MD 20871-9160",Clarksburg,MD,http://www.montgomerycountygolf.com,,,,,,,,,,
The Links Golf Club,"11425 N Pr Links Ln, New Palestine, IN 46163-9307",New Palestine,IN,http://www.linksindy.com,,,,,,,,,,
College Park Municipal Golf Course,"3711 Fairway Dr, College Park, GA 30337",College Park,GA,http://www.cp9golf.com,,,,,,,,,,
Deer Island Golf & Lake Club,"18000 Eagles Way, Tavares, FL 32778",Tavares,FL,http://www.deerislandcc.com/,,,,,,,,,,
Chapel Hill Country Club,"2500 N Chapel Hill Rd, Mchenry, IL 60051-3630",Mchenry,IL,http://www.chapelhillgc.com,,,,,,,,,,
Newport Beach Golf Course,"3100 Irvine Ave, Newport Beach, CA 92660-3104",Newport Beach,CA,http://www.npbgolf.com,,,,,,,,,,
Burke Lake Park Golf Course,"7315 Ox Rd, Fairfax Station, VA 22039",Fairfax Station,VA,http://www.fairfaxcounty.gov/parks/golf/blgc/,,,,,,,,,,
White Pines Golf Club - East,"500 West Jefferson Street, Bensenville, IL 60106",Bensenville,IL,http://www.whitepinesgolf.com,,,,,,,,,,
Olde Beau Golf Club,"US Highway 21, Roaring Gap, NC 28668",Roaring Gap,NC,http://www.oldebeau.com,,,,,,,,,,
Lakeland Golf Course,"1772 Kiser Lake Rd, Saint Paris, OH 43072-9217",Saint Paris,OH,http://www.lakelandgolfclub.com,,,,,,,,,,
Heron Lakes - Great Blue,"3500 N Victory Blvd, Portland, OR",Portland,OR,http://www.heronlakesgolf.com/,,,,,,,,,,
Royal Kaanapali,"2290 KAANAPALI PARKWAY, Lahaina, HI",Lahaina,HI,http://www.kaanapali-golf.com,,,,,,,,,,
Windance Country Club,"19385 Champion Cir, Gulfport, MS 39503-7707",Gulfport,MS,http://www.windancecc.com,,,,,,,,,,
Pine View Golf Club,"5820 Stony Creek Road, Ypsilanti, MI 48197",Ypsilanti,MI,http://www.pineviewgc.com/,,,,,,,,,,
Top O The Lake Country Club,"676 Country Club Road, Bowie, TX 76230",Bowie,TX,http://www.topothelakecountryclub.com,,,,,,,,,,
Marriott Shadow Ridge,"9003 Shadow Ridge Rd, Palm Desert, CA 92211-2057",Palm Desert,CA,http://www.golfshadowridge.com,,,,,,,,,,
Tahquitz Creek - Resort Course,"1885 Golf Club Dr, Palm Springs, CA 92264",Palm Springs,CA,http://www.tahquitzgolfresort.com/,,,,,,,,,,
Tameka Woods Golf Course,"4849 S 450 W, Trafalgar, IN 46181",Trafalgar,IN,http://www.tamekawoods.com,,,,,,,,,,
Laguna Seca Golf Club,"10520 York Rd, Monterey, CA 93940-6538",Monterey,CA,http://www.lagunasecagolf.com,,,,,,,,,,
Palo Verde Golf Course,"6215 N 15th Ave, Phoenix, AZ 85015-2002",Phoenix,AZ,https://www.phoenix.gov/parks/golf/phoenix-golf-courses/palo-verde,,,,,,,,,,
Angus Lea Golf Course,"126 Main S, Hillsborough, NH 03244",Hillsborough,NH,http://www.anguslea.com/,,,,,,,,,,
Suncrest Golf Course,"137 Brownsdale Rd, Butler, PA 16002-0419",Butler,PA,http://www.suncrestgolf.com,,,,,,,,,,
Mississippi National - Lowlands,"409 Golf Links Dr, Red Wing, MN",Red Wing,MN,http://www.golfredwing.com/,,,,,,,,,,
Jupiter Dunes Golf Course,"401 N Highway A1A, Jupiter, FL 33477",Jupiter,FL,https://www.jupiterdunesgolf.net/,,,,,,,,,,
Lakota Canyon Ranch Golf Club,"1000 Clubhouse Dr, New Castle, CO 81647-8507",New Castle,CO,http://www.lakotacanyonranch.com,,,,,,,,,,
Geneva National - Trevino,"1221 Geneva National Ave S., Lake Geneva, WI 53147",Lake Geneva,WI,http://www.genevanationalresort.com/,,,,,,,,,,
Foxtail Golf Club - Redwoods (North) Course,"100 Golf Course Dr, Rohnert Park, CA 94928",Rohnert Park,CA,http://www.playfoxtail.com,,,,,,,,,,
Woodcreek Golf Club,"5880 Woodcreek Oaks Boulevard, Roseville, CA 95747",Roseville,CA,http://www.golfroseville.com/golf/proto/golfroseville/woodcreek_course/woodcreek_course.htm,,,,,,,,,,
Mohawk Park - Woodbine - Woodbine Course,"5223 E 41st St N, Tulsa, OK 74115-1319",Tulsa,OK,http://www.tulsagolf.org/Mohawk-Park-Golf-Course.html,,,,,,,,,,
Wildfire Golf Club - Faldo Course,"5350 E Marriott Dr, Phoenix, AZ 85054-6147",Phoenix,AZ,http://www.wildfiregolf.com,,,,,,,,,,
Mount Dora Golf Club,"1100 S Highland St, Mount Dora, FL 32757",Mount Dora,FL,http://www.mountdoragolf.com,,,,,,,,,,
New Paltz Golf Course,"215 Huguenot Street, New Paltz, NY 12561",New Paltz,NY,http://www.newpaltzgolf.com/,,,,,,,,,,
Bay Hills Golf Club,"545 Bay Hills Dr., Arnold, MD 21012",Arnold,MD,http://bayhillsgc.com/,,,,,,,,,,
Falcon Valley,"9801 Falcon Valley Dr, Lenexa, KS 66220",Lenexa,KS,http://www.falconvalleygolf.com,,,,,,,,,,
The UNC Finley Golf Club,"Finley Golf Course Rd, Chapel Hill, NC 27514",Chapel Hill,NC,http://www.uncfinley.com,,,,,,,,,,
Rancho Manana Golf Club,"5734 E Rancho Manana Blvd, Cave Creek, AZ 85331-8588",Cave Creek,AZ,http://www.ranchomanana.com,,,,,,,,,,
Dove Valley Ranch,"33750 N Dove Lakes Dr, Cave Creek, AZ 85331-5001",Cave Creek,AZ,http://www.dovevalleyranch.com,,,,,,,,,,
Ko Olina Golf Club,"92-1220 Aliinui Dr., Kapolei, HI 96707",Kapolei,HI,http://www.koolinagolf.com/,,,,,,,,,,
Deerpath Golf Course,"500 W Deerpath, Lake Forest, IL 60045-1637",Lake Forest,IL,https://www.deerpathgolf.com,,,,,,,,,,
Goose Pond Colony Golf Course | Plantation,"417 Ed Hembree Dr, Scottsboro, AL 35769-7859",Scottsboro,AL,http://www.goosepond.org,,,,,,,,,,
Pine Brook Golf Club,"11043 Durkee Road, Grafton, OH 44044",Grafton,OH,http://www.pinebrookgc.com/,,,,,,,,,,
Bowie Golf & Country Club,"7420 Laurel Bowie Rd, Bowie, MD 20715-1717",Bowie,MD,http://www.bowiegolf.com,,,,,,,,,,
Riverbend Golf Complex - 18 Hole Course,"2019 W Meeker St, Kent, WA 98032-4216",Kent,WA,http://www.ci.kent.wa.us,,,,,,,,,,
Max Starcke Park Golf Club,"650 River Dr W, Seguin, TX 78155-6407",Seguin,TX,http://www.ci.seguin.tx.us/general/golf.htm,,,,,,,,,,
Alfred 'Tup' Holmes Golf Course,"2300 Wilson Dr SW, Atlanta, GA 30311-3338",Atlanta,GA,https://www.golfnow.com/courses/1028877-alfred-tup-holmes-golf-course-details,,,,,,,,,,
Marquette Park Golf Course,"6700 S Kedzie Ave, Chicago, IL 60629",Chicago,IL,http://marquettepark.cpdgolf.com/,,,,,,,,,,
Tour 18 Golf Course Houston,"3102 Farm Market 1960 Rd E, Humble, TX 77338",Humble,TX,http://www.tour18golf.com,,,,,,,,,,
Morongo Golf Club at Tukwet Canyon - Legends,"36211 Champions Dr, Beaumont, CA 92223",Beaumont,CA,http://www.tukwetcanyon.com,,,,,,,,,,
Tekoa Country Club,"459 Russell Rd, Westfield, MA 01085-2102",Westfield,MA,https://tekoacc.com/,,,,,,,,,,
The Links at Hiawatha,"2350 Marshland Rd, Apalachin, NY 13732-",Apalachin,NY,http://www.hiawathalinks.com,,,,,,,,,,
Pierce Community Golf Course,"85428 548th Ave, Pierce, NE 68767-3569",Pierce,NE,http://www.ptcnet.net/golfcourse.htm,,,,,,,,,,
Beechwood Golf Course,"2222 Woodlawn Drive, La Porte, IN 46350",La Porte,IN,http://www.thebeechwoodgolfcourse.com/,,,,,,,,,,
Reid Memorial Park Golf Course South,"1301 Mitchell Boulevard, Springfield, OH",Springfield,OH,http://ntprdreidmemorial.phantomgolf.com/,,,,,,,,,,
Greatwood Golf Club,"6767 Greatwood Pkwy, Sugar Land, TX 77479-6398",Sugar Land,TX,http://www.greatwoodgolf.com,,,,,,,,,,
Lincoln Hills Golf Club - Hills Course,"1005 Sun City Lane, Lincoln, CA 95648",Lincoln,CA,http://www.lincolnhillsgolfclub.com,,,,,,,,,,
Redland Golf and Country Club,"24451 SW 177th Ave, Homestead, FL 33031",Homestead,FL,http://redlandgolf.com,,,,,,,,,,
Elk River Golf Club,"20015 Elk Lake Road, Elk River, MN 55330",Elk River,MN,http://www.elkrivercc.com,,,,,,,,,,
Lakeview Golf Resort and Spa - Lakeview Course,"1 Lakeview Dr, Morgantown, WV 26508-8061",Morgantown,WV,http://www.lakeviewresort.com,,,,,,,,,,
Springvale Golf Club,"5871 Canterbury Rd, North Olmsted, OH 44070-4522",North Olmsted,OH,http://www.north-olmsted.com/springvalegolfcourse.cfm,,,,,,,,,,
Grand Bear Golf Club,"12040 Grand Way Blvd, Saucier, MS",Saucier,MS,https://grandbeargolf.com/,,,,,,,,,,
The Links At Victoria Park,"340 E 192nd St, Carson, CA 90746-2207",Carson,CA,http://www.linksatvictoria.com,,,,,,,,,,
Tpc At Deere Run,"3100 Heather Knl, Silvis, IL 61282",Silvis,IL,http://www.tpc.com/tpc-deere-run,,,,,,,,,,
General Old Golf Course,"16700 Village West Dr, Riverside, CA 92518-2888",Riverside,CA,http://www.generaloldgolfcourse.com,,,,,,,,,,
Ed Oliver Golf Club,"800 N Dupont Rd, Wilmington, DE 19807",Wilmington,DE,http://www.edolivergolfclub.com,,,,,,,,,,
The Dunes At Maui Lani Golf Course,"1333 Mauilani Pkwy, Kahului, HI 96732-2542",Kahului,HI,http://dunesatmauilani.com/,,,,,,,,,,
Golf Club of Estrella,"11800 S Golf Club Dr, Goodyear, AZ 85338-9512",Goodyear,AZ,http://www.estrellagolf.com,,,,,,,,,,
Waterview Golf Club,"75089 Waterview Pkwy, Rowlett, TX 75089",Rowlett,TX,https://www.waterviewgc.com/,,,,,,,,,,
Heron Creek Golf Club,"0615 West 050 North, Lagrange, IN 46761",Lagrange,IN,http://www.heroncreekgolfclub.com/,,,,,,,,,,
Arrowhead Pointe at Richard B Russell,"2790 Olympic Rowing Dr, Elberton, GA 30635",Elberton,GA,http://www.arrowheadpointegc.com/,,,,,,,,,,
Cerbat Cliffs Golf Course,"1001 Gates Avenue, Kingman, AZ 86401",Kingman,AZ,http://cerbatcliffsgc.com/,,,,,,,,,,
Pickaway Country Club,"1399 Stoutsville Pike, Circleville, OH 43113-8987",Circleville,OH,http://www.pickawaycc.com,,,,,,,,,,
Lake City Golf Club,"33587 Lakeview Dr, Lake City, MN 55041-3261",Lake City,MN,http://www.lakecitygolf.com,,,,,,,,,,
Furnace Creek Golf Course,"Highway 190, Death Valley, CA 92328",Death Valley,CA,http://www.furnacecreekresort.com,,,,,,,,,,
Countryland Golf Club,"6560 Mayfield Drive, Cumming, GA 30041",Cumming,GA,http://www.countrylandgolf.com,,,,,,,,,,
Heron's Glen Golf & Country Club,"2250 Avenida del Vera, North Fort Myers, FL 33917-6700",North Fort Myers,FL,http://www.hggcc.com/,,,,,,,,,,
Sherman Hills Golf Club,"31200 Eagle Falls Drive, Brooksville, FL 34602",Brooksville,FL,http://www.shermanhillsgolf.com/,,,,,,,,,,
Stonebridge Golf Links & Country Club,"2000 Raynors Way, Smithtown, NY 11787-4465",Smithtown,NY,http://www.stonebridgeglcc.com,,,,,,,,,,
Wedgewood Golfers' Club,"5206 Tournament Drive, Olive Branch, MS 38654",Olive Branch,MS,http://www.wwncgolf.com,,,,,,,,,,
Bay Harbor Golf Club - Preserve-Links,"3600 Village Harbor Drive, Bay Harbor, MI 49770",Bay Harbor,MI,http://www.bayharborgolf.com/,,,,,,,,,,
Waukewan Golf Club,"Waukewan Rd, Center Harbor, NH 03226",Center Harbor,NH,http://www.waukewan.com,,,,,,,,,,
Schalamar Creek Golf Club,"4500 US Highway 92 E, Lakeland, FL 33801-9457",Lakeland,FL,http://www.schalamar.com,,,,,,,,,,
Myrtle Beach National Golf Course - Southcreek Course,"4900 National Dr, Myrtle Beach, SC 29579",Myrtle Beach,SC,http://www.mbn.com,,,,,,,,,,
Chambers Bay Golf Club,"6320 Grandview Dr W, University Place, WA 98467",University Place,WA,http://www.chambersbaygolf.com,,,,,,,,,,
Lake Doster Golf Club,"116 Country Club Blvd, Plainwell, MI 49080-9120",Plainwell,MI,http://www.lakedostergolf.com,,,,,,,,,,
Raritan Landing Golf Course,"491 Sidney Rd, Piscataway, NJ 08854-4149",Piscataway,NJ,http://www.mciauth.com,,,,,,,,,,
Pierce Lake Golf Course,"1175 S Main, St. Chelsea, MI",St. Chelsea,MI,http://www.piercelakegolf.com/,,,,,,,,,,
Mauna Kea Resort,"62-100 Mauna Kea Beach Dr, Kamuela, HI 96743-9706",Kamuela,HI,https://maunakeabeachhotel.com/,,,,,,,,,,
Currie Municipal Golf Course - West,"1300 Currie Pkwy, Midland, MI","Midland,",MI,http://www.curriegolf.com,,,,,,,,,,
Maple River Golf Club,"3666 163rd Ave SE, West Fargo, ND 58078",West Fargo,ND,http://www.maplerivergolfclub.com,,,,,,,,,,
Cary Country Club,"2400 Grove Ln, Cary, IL 60013-2741",Cary,IL,http://www.carycountryclub.com,,,,,,,,,,
Mountain Branch Golf Course,"1827 Mountain Rd, Joppa, MD 21085-1918",Joppa,MD,http://www.mountainbranch.com,,,,,,,,,,
Kissena Park Golf Course,"16415 Booth Memorial Ave, Fresh Meadows, NY 11365-1532",Fresh Meadows,NY,http://www.golfnyc.com/kissena_home/,,,,,,,,,,
Poipu Bay Golf Course,"2250 Ainako St, Koloa, HI 96756",Koloa,HI,http://poipubaygolf.com,,,,,,,,,,
Oyster Bay Golf Links,"614 Lake Shore Dr, Sunset Beach, NC 28468-4510",Sunset Beach,NC,http://www.legendsgolf.com,,,,,,,,,,
Wyaton Hills Golf Course,"17879 1500 North Ave, Princeton, IL 61356-6813",Princeton,IL,http://www.facebook.com/Wyaton-Hills-Golf-Course-120021978014131/,,,,,,,,,,
Coronado Golf Course,"2829 N Miller Rd, Scottsdale, AZ 85257-1610",Scottsdale,AZ,http://www.coronadogolfscottsdale.com,,,,,,,,,,
Bridgemill Athletic Club,"1190 Bridge Mill Ave, Canton, GA 30114-7712",Canton,GA,http://www.bridgemillathleticclub.com,,,,,,,,,,
Altadena Golf Course,"1456 E Mendocino St, Altadena, CA 91001",Altadena,CA,http://parks.lacounty.gov/wps/portal/dpr/ThingsToDo/Golf/Altadena_Golf_Course,,,,,,,,,,
Serenoa Golf Club,"6773 Serenoa Dr, Sarasota, FL 34241",Sarasota,FL,http://serenoagc.com,,,,,,,,,,
The Canyons At Blackjack Ridge,"1801 N McKinley Ave, Sand Springs, OK 74063-8302",Sand Springs,OK,http://www.thecanyonsatblackjackridge.com,,,,,,,,,,
Audubon Park Golf Course,"6500 Magazine St, New Orleans, LA 70118-4848",New Orleans,LA,http://audubonnatureinstitute.org/golf,,,,,,,,,,
Pinnacle Country Club,"200 Pinnacle Club Dr, Mabank, TX 75156-6005",Mabank,TX,http://www.pinnaclegolfclub.com,,,,,,,,,,
Tour 18 Golf Course Dallas,"8718 Amen Cor, Flower Mound, TX 75022-6498",Flower Mound,TX,http://www.tour18-dallas.com,,,,,,,,,,
Fox Bend Golf Course,"3516 US Highway 34, Oswego, IL 60543-8943",Oswego,IL,http://www.foxbendgolfcourse.com,,,,,,,,,,
Grand Ridge Golf Club,"500 Willowdale Blvd, Luling, LA 70070",Luling,LA,http://www.grandridgegolf.com/index.htm,,,,,,,,,,
Sun City Country Club,"9433 N 107th Ave, Sun City, AZ 85351-4605",Sun City,AZ,http://www.suncitycountryclub.org,,,,,,,,,,
The Creek At Hard Labor,"1400 Knox Chapel Rd, Social Circle, GA 30025-4526",Social Circle,GA,http://www.georgiagolf.com,,,,,,,,,,
Point Venture Golf Course,"422 Venture Blvd S, Point Venture, TX 78645-8543",Point Venture,TX,http://pointventuregolf.com,,,,,,,,,,
Elbel Park Golf Club,"26595 Auten Road, South Bend, IN 46628",South Bend,IN,http://www.sbparks.org,,,,,,,,,,
Salem Hills Golf Club,"8810 6 Mile Rd, Northville, MI 48167",Northville,MI,http://salemhillsgolfclub.com,,,,,,,,,,
Lake Wales Country Club,"E State Rd 60, Lake Wales, FL",Lake Wales,FL,http://www.lakewalescc.com/,,,,,,,,,,
Santee National Golf Course,"8636 Old Number Six Highway, Santee, SC 29142",Santee,SC,http://www.santeenational.com,,,,,,,,,,
Ely Park Golf Course,"67 Ridge St, Binghamton, NY 13905-1730",Binghamton,NY,http://www.elyparkgolf.com,,,,,,,,,,
Camelback Golf Club - Padre Course,"7847 N Mockingbird Ln, Paradise Valley, AZ 85253",Paradise Valley,AZ,http://www.marriott.com/golf-hotels/phxcb-jw-marriott-scottsdale-camelback-inn-resort-and-spa/camelback-golf-club/5256759/home-page.mi,,,,,,,,,,
Cumberland Golf Club,"2395 Ritner Hwy, Carlisle, PA 17015-9316",Carlisle,PA,http://www.81fun.com/golf/proto/81fun/golf_home/golf_home.htm,,,,,,,,,,
Las Sendas Golf Club,"7555 E Eagle Crest Dr, Mesa, AZ 85207-1053",Mesa,AZ,http://www.lassendas.com,,,,,,,,,,
Port Royal Golf Club - Robber's Row,"10 Clubhouse Dr, Hilton Head Island, SC 29928",Hilton Head Island,SC,http://www.portroyalgolfclub.com,,,,,,,,,,
Fox Hollow Golf Club,"10050 Robert Trent Jones Pkwy, New Port Richey, FL 34655",New Port Richey,FL,http://golfthefox.com,,,,,,,,,,
College Heights Country Club,"1225 E 4th St, Crete, NE 68333-3220",Crete,NE,https://www.chccgolf.com,,,,,,,,,,
Paradise Valley Golf Course,"3950 Paradise Valley Dr, Fairfield, CA 94533-9701",Fairfield,CA,http://www.fairfieldgolf.com,,,,,,,,,,
Rawiga Golf & Country Club,"10353 Rawiga Road, Seville, OH 44273",Seville,OH,http://www.rawigacc.com,,,,,,,,,,
Indian Trails Golf Course,"2776 Kalamazoo Ave SE, Grand Rapids, MI 49507-3940",Grand Rapids,MI,http://www.grand-rapids.mi.us,,,,,,,,,,
Eagle Dunes Golf Club,"24000 Marbella Drive, Sorrento, FL 32776",Sorrento,FL,http://www.eagledunes.com,,,,,,,,,,
Cathedral Canyon Golf Club - Lake Course,"68311 Paseo Real, Cathedral City, CA 92234-6767",Cathedral City,CA,http://www.cathedral-canyon.com,,,,,,,,,,
Wyckoff Country Club,"233 Easthampton Rd, Holyoke, MA 01040-1228",Holyoke,MA,http://www.wyckoffcountryclub.com,,,,,,,,,,
Silverhorn Golf Club,"1100 W Bitters Rd, San Antonio, TX 78216-7809",San Antonio,TX,http://www.silverhorngolfclub.com,,,,,,,,,,
Azalea City Golf Course,"1000 Gaillard Drive, Mobile, AL 36608",Mobile,AL,http://www.azaleacitygolfcourse.com/,,,,,,,,,,
Reid Memorial Park Golf Course - North Course,"1325 S Bird Rd, Springfield, OH 45505-3503",Springfield,OH,http://www.ci.springfield.oh.us,,,,,,,,,,
Downingtown Golf Club,"85 Country Club Dr, Downingtown, PA 19335-3060",Downingtown,PA,http://www.golfdowningtown.com,,,,,,,,,,
Superstition Springs Golf Club,"6542 E Baseline Rd, Mesa, AZ 85206-4300",Mesa,AZ,http://www.superstitionspringsgc.com,,,,,,,,,,
Sawmill Creek Golf Club & Resort,"2901 Cleveland Rd W, Huron, OH 44839",Huron,OH,http://www.golfsawmillcreek.com,,,,,,,,,,
Mountain Vista Golf Club - Santa Rosa,"38180 Del Webb Blvd., Palm Desert, CA 92211",Palm Desert,CA,http://www.mountainvistagolfclub.com/index.php,,,,,,,,,,
Paw Paw Lake Golf Course,"4548 Forest Beach Rd, Watervliet, MI 49098",Watervliet,MI,http://www.pplgcgolf.com,,,,,,,,,,
Raccoon International Golf Course,"3275 Worthington Rd SW, Granville, OH 43023",Granville,OH,http://www.raccooninternational.com,,,,,,,,,,
Eagle Knoll Golf Club,"5757 E. Eagle Knoll Drive, Hartsburg, MO 65039",Hartsburg,MO,https://www.eagleknoll.com/,,,,,,,,,,
Piper Glen,"7112 Piper Glen Drive, Springfield, IL 62711",Springfield,IL,http://www.piperglen.com,,,,,,,,,,
WildHorse Golf Club,"2100 Warm Springs Road, Henderson, NV 89014",Henderson,NV,http://www.golfwildhorse.com,,,,,,,,,,
Timberlake Plantation Golf Course,"284 Club Dr, Chapin, SC 29036-8454",Chapin,SC,http://www.timberlakecountryclub.com,,,,,,,,,,
Colts Neck Golf Club,"50 Flock Road, Colts Neck, NJ 07722",Colts Neck,NJ,http://www.coltsneckgolfclub.com/,,,,,,,,,,
Candler Hills Golf Club,"8137 SW 90th Terrace Rd., Ocala, FL 34481",Ocala,FL,http://www.candlerhillsgolfclub.com,,,,,,,,,,
Dr. Charles L. Sifford Golf Course at Revolution Park,"1225 Remount Road, Charlotte, NC 28208",Charlotte,NC,http://www.charlottepublicgolf.com/charles-l-sifford-gc.html,,,,,,,,,,
TGC at Pleasant Point Plantation,"8 Barnwell Drive, LADYS ISLAND, SC 29907",LADYS ISLAND,SC,http://tgcppp.com,,,,,,,,,,
Grey Hawk Golf Club,"665 U S Grant St, Lagrange, OH 44050-8508",Lagrange,OH,http://www.greyhawkgolf.com,,,,,,,,,,
Golden Hills Golf & Country Club,"100 Scotland Dr, Lexington, SC 29072-8052",Lexington,SC,http://www.goldenhillsgolf.com,,,,,,,,,,
Twin Lakes Golf Course,"400 W 59th St, Westmont, IL 60559",Westmont,IL,http://westmontparks.org/twin-lakes-golf-club/course-layout.htm,,,,,,,,,,
Tamarack Golf Club,"50771 Colorado 71, Limon, CO 80828",Limon,CO,http://www.tamarackcc.com,,,,,,,,,,
The Resort at Glade Springs - Stonehaven,"255 Resort Drive, Daniels, WV 25832",Daniels,WV,http://www.gladesprings.com/,,,,,,,,,,
Salt Creek Golf Club,"1051 N. Prospect Avenue Suite A, Wood Dale, IL 60191",Wood Dale,IL,http://www.saltcreekgolfclub.com,,,,,,,,,,
Glen Dornoch Golf Links,"4840 Glen Dornoch Way, Little River, SC 29566",Little River,SC,http://www.glensgolfgroup.com,,,,,,,,,,
Hickory Valley Golf Club - Presidential Course,"1921 Ludwig Rd, Gilbertsville, PA 19525-9438",Gilbertsville,PA,http://www.hickoryvalley.com,,,,,,,,,,
Streator Country Club,"2000 Eastwood Ave, Streator, IL 61364-1073",Streator,IL,http://www.eastwoodtwincreeks.com,,,,,,,,,,
Upland Hills Country Club,"1231 E 16th St, Upland, CA 91784-2450",Upland,CA,https://www.golfuplandhillscountryclub.com/,,,,,,,,,,
The Lakes At Laura S. Walker,"5500 Laura Walker Rd, Waycross, GA 31503-0951",Waycross,GA,http://gastateparks.org/The-Lakes,,,,,,,,,,
Northwood Golf Course,"3131 Golf Course Rd, Rhinelander, WI 54501-8177",Rhinelander,WI,http://www.northwoodgolfclub.com,,,,,,,,,,
Morris Williams Golf Course,"4305 Manor Rd, Austin, TX 78723-5901",Austin,TX,http://www.ci.austin.tx.us/parks/morriswilliams.htm,,,,,,,,,,
Alburg Golf Links,"230 Route 129, Alburg, VT 05440",Alburg,VT,http://www.alburggolflinks.com,,,,,,,,,,
Los Caballeros Golf Club,"1551 South Vulture Mine Rd, Wickenburg, AZ 85390",Wickenburg,AZ,https://www.ranchodeloscaballeros.com/golf-club,,,,,,,,,,
Pryor Creek Golf Course,"724 E 530, Pryor, OK 74361-2863",Pryor,OK,http://www.pryorcreekgolf.org/,,,,,,,,,,
Pleasant Hills,"4452 E Millbrook Rd, Mount Pleasant, MI 48858-9108",Mount Pleasant,MI,http://www.pleasanthillsgolfcourse.com,,,,,,,,,,
Sabal Springs Golf & Racquet Club,"3410 Clubview Dr., Fort Myers, FL 33917",Fort Myers,FL,http://www.sabalspringsgolf.com,,,,,,,,,,
Dix Hills Park Golf Course,"575 Vanderbilt Pkwy, Dix Hills, NY 11746-5435",Dix Hills,NY,https://www.dixhillsgolf.com/,,,,,,,,,,
Skytop Lodge Golf Course,"1 Skytop Ldg Rd., Skytop, PA 18357-1001",Skytop,PA,http://www.skytop.com,,,,,,,,,,
The Golf Club at Sanctuary Cove,"2050 Sanctuary Wynd, Waverly, GA 31565",Waverly,GA,http://www.sanctuarycovegolf.com,,,,,,,,,,
Indian Boundary Golf Course,"8600 W Forest Preserve Avenue, Chicago, IL 60634",Chicago,IL,https://indianboundary.forestpreservegolf.com/,,,,,,,,,,
Yorktown Golf Complex,"300 Goalby Dr, Belleville, IL 62221-3191",Belleville,IL,http://www.yorktowngolf.net,,,,,,,,,,
Seaview Golf Resort - Bay Course,"401 S New York Rd, Absecon, NJ 08205-9753",Absecon,NJ,http://www.seaviewgolf.com,,,,,,,,,,
The Bear Trace At Tims Ford,"891 Wiseman Bend Rd, Winchester, TN 37398-3881",Winchester,TN,http://www.tnstateparks.com,,,,,,,,,,
Town of Wallkill Golf Club,"40 Sands Rd., Middletown, NY 10941",Middletown,NY,http://www.townofwallkill.com/golfclub,,,,,,,,,,
River Vale Country Club,"660 Rivervale Rd, River Vale, NJ 07675-6479",River Vale,NJ,http://www.rivervalecc.com,,,,,,,,,,
Ridgeview Ranch Golf Club,"2701 Ridgeview Dr, Plano, TX",Plano,TX,http://www.ridgeviewgc.com/,,,,,,,,,,
Glen Oak Golf Course,"711 Smith Rd, East Amherst, NY 14051-1102",East Amherst,NY,http://www.glenoak.com,,,,,,,,,,
Buenaventura Golf Course,"5882 Olivas Park Drive, Ventura, CA 93003",Ventura,CA,http://www.buenaventuragolf.com,,,,,,,,,,
Lewisburg Recreation Center,"1551 Mooresville Highway, Lewisburg, TN 37091",Lewisburg,TN,http://www.lewisburgtn.gov/lewisburg-recreation-center.html,,,,,,,,,,
Sah-Hah-Lee,"17104 SE 130th Ave, Clackamas, OR 97015",Clackamas,OR,http://www.sah-hah-lee.com,,,,,,,,,,
